{
  "$schema": "http://json-schema.org/draft-07/schema#",
  "$id": "https://runthe.gg/schema/threads.schema.json",
  "title": "RunTheCase Thread Map",
  "description": "The overarching mystery: villain, antagonist network, hidden breadcrumbs, and cross-case callbacks. Authors' data — drives flag-setting per ENGINE-SPEC §5, never shown verbatim to the player.",
  "type": "object",
  "additionalProperties": false,
  "required": ["villain_id", "antagonist_ids", "breadcrumbs", "callbacks"],
  "properties": {
    "villain_id": { "type": "string", "description": "ref -> characters.json id" },
    "antagonist_ids": { "type": "array", "items": { "type": "string" } },
    "inside_man_id": {
      "type": ["string", "null"],
      "description": "ref -> characters.json id. The recurring character who is eventually revealed as the villain's mole. Internal only."
    },
    "breadcrumbs": {
      "type": "array",
      "description": "Hidden thread clues scattered across cases. Each corresponds to evidence with is_clue:false + this tag in some case's evidence[].thread_tag.",
      "items": {
        "type": "object",
        "additionalProperties": false,
        "required": ["id", "case_id", "surfaces"],
        "properties": {
          "id": { "type": "string", "pattern": "^bc_[a-z0-9_]+$" },
          "case_id": { "type": "string", "description": "ref -> the case this breadcrumb first appears in" },
          "surfaces": { "type": "string", "description": "What this breadcrumb quietly establishes, for authors only" },
          "character_ids": { "type": "array", "items": { "type": "string" }, "default": [] }
        }
      }
    },
    "callbacks": {
      "type": "array",
      "description": "Cross-case references (a later case's staging/evidence explicitly echoes an earlier one).",
      "items": {
        "type": "object",
        "additionalProperties": false,
        "required": ["id", "from_case_id", "to_case_id", "note"],
        "properties": {
          "id": { "type": "string", "pattern": "^cb_[a-z0-9_]+$" },
          "from_case_id": { "type": "string" },
          "to_case_id": { "type": "string" },
          "note": { "type": "string" }
        }
      }
    }
  }
}
