{
  "villain_id": "villain_voss",
  "antagonist_ids": ["antag_nadia", "antag_boone"],
  "inside_man_id": "det_okafor",
  "breadcrumbs": [
    { "id": "bc_voss_invoice", "case_id": "modern_04_water_damage", "surfaces": "First shell-company invoice bearing Voss's registered-agent signature block. Establishes the paperwork trail the whole network eventually hangs on.", "character_ids": ["villain_voss"] },
    { "id": "bc_shell_receipt", "case_id": "modern_07_paper_trail", "surfaces": "A second shell company, same registered-agent boilerplate as bc_voss_invoice, different shell name.", "character_ids": ["villain_voss"] },
    { "id": "bc_boone_glimpse_first", "case_id": "modern_10_quiet_neighbor", "surfaces": "An unidentified large man seen leaving a scene calmly, pre-dating his identification as Boone in Case 30.", "character_ids": ["antag_boone"] },
    { "id": "bc_shell_lease", "case_id": "modern_12_short_lease", "surfaces": "A shell company leases the storage unit at the center of the case; dressed to match Voss's compliance-consultant cover once that profession is locked in.", "character_ids": ["villain_voss"] },
    { "id": "bc_boone_contact", "case_id": "modern_30_cleanup_crew", "surfaces": "Boone confirmed as a contract cleaner taking anonymous jobs; first direct link from a body to the network's cleanup arm.", "character_ids": ["antag_boone"] },
    { "id": "bc_wire_transfer", "case_id": "modern_15_dead_drop", "surfaces": "A wire transfer routed through two of the shell companies already seeded in bc_voss_invoice / bc_shell_receipt.", "character_ids": ["villain_voss"] },
    { "id": "bc_offshore_ledger", "case_id": "modern_18_double_entry", "surfaces": "A partial offshore ledger page; numbers don't resolve yet but the account prefix recurs later in bc_network_map_partial.", "character_ids": ["villain_voss"] },
    { "id": "bc_nadia_voice", "case_id": "modern_20_house_call", "surfaces": "A witness describes being warned off by a woman's voice on the phone — first trace of Nadia before she's named.", "character_ids": ["antag_nadia"] },
    { "id": "bc_witness_silenced", "case_id": "modern_23_recanted", "surfaces": "A witness recants under pressure that doesn't match the case at hand — Nadia's fixer work, still unattributed.", "character_ids": ["antag_nadia"] },
    { "id": "bc_compliance_stamp", "case_id": "modern_25_notarized", "surfaces": "A forged notary stamp matching the registered-agent cover from bc_shell_lease. Confirms the shell network is centrally run, not incidental.", "character_ids": ["villain_voss"] },
    { "id": "bc_okafor_hesitation", "case_id": "modern_28_first_body", "surfaces": "Okafor talks the player out of pulling a thread that, in hindsight, led toward the network. Internal only — never framed as suspicious in any player-facing text.", "character_ids": ["det_okafor"] },
    { "id": "bc_network_map_partial", "case_id": "modern_33_loose_ends", "surfaces": "A partial org chart recovered from a cleanup job gone wrong; account prefix matches bc_offshore_ledger.", "character_ids": ["villain_voss", "antag_boone"] },
    { "id": "bc_voss_signature", "case_id": "modern_36_paper_tiger", "surfaces": "A physical signature sample for Voss, first time the name is attached to actual handwriting rather than typed paperwork.", "character_ids": ["villain_voss"] },
    { "id": "bc_okafor_ledger_match", "case_id": "modern_39_familiar_hand", "surfaces": "Handwriting analysis on a network ledger returns a partial match the player isn't shown in full. Internal escalation of bc_okafor_hesitation toward the Case 08/31/34 reveal arc.", "character_ids": ["det_okafor"] },
    { "id": "bc_villain_reveal_thread", "case_id": "modern_42_the_ledger", "surfaces": "The completed network map, ready to pay off at the finale. Last breadcrumb before the story-gate case.", "character_ids": ["villain_voss", "antag_nadia", "antag_boone", "det_okafor"] }
  ],
  "callbacks": [
    { "id": "cb_case14_staging", "from_case_id": "modern_14_open_and_shut", "to_case_id": "modern_30_cleanup_crew", "note": "The staged-scene technique first seen in Case 14 (a break-in dressed to look random) reappears refined in Boone's overdose staging." },
    { "id": "cb_case04_to_case12", "from_case_id": "modern_04_water_damage", "to_case_id": "modern_12_short_lease", "note": "Same registered-agent boilerplate language links the two shell-company breadcrumbs." },
    { "id": "cb_case12_to_case25", "from_case_id": "modern_12_short_lease", "to_case_id": "modern_25_notarized", "note": "The notary stamp forged in Case 25 matches the registration paperwork style from Case 12." },
    { "id": "cb_case18_to_case33", "from_case_id": "modern_18_double_entry", "to_case_id": "modern_33_loose_ends", "note": "The offshore account prefix from Case 18's ledger fragment recurs in the partial org chart recovered in Case 33." },
    { "id": "cb_case28_to_case39", "from_case_id": "modern_28_first_body", "to_case_id": "modern_39_familiar_hand", "note": "Okafor's steer-away in Case 28 gets a quiet, unresolved echo when his handwriting partially matches a ledger in Case 39." },
    { "id": "cb_case33_to_case42", "from_case_id": "modern_33_loose_ends", "to_case_id": "modern_42_the_ledger", "note": "The partial org chart from Case 33 completes into the full network map that gates the finale." }
  ]
}
